{
  "id": "cbse-10-science-periodic_classification_of_elements",
  "curriculum": "CBSE",
  "class": 10,
  "stream": null,
  "subject": "science",
  "chapter_number": 5,
  "chapter_title": "Periodic Classification of Elements",
  "language": "en",
  "book": "NCERT Science (Class 10)",
  "version": "1.0",
  "summary": {
    "short_summary": "This chapter introduces the main ideas of Periodic Classification of Elements in science.",
    "detailed_summary": "This chapter for Class 10 science explains the core concepts of Periodic Classification of Elements. It is intended as a structured study summary for CBSE learners.",
    "key_concepts": [
      {
        "title": "Introduction to Periodic Classification of Elements",
        "explanation": "This concept introduces the basic idea of Periodic Classification of Elements."
      },
      {
        "title": "Core ideas in Periodic Classification of Elements",
        "explanation": "This concept covers the main principles and important points in Periodic Classification of Elements."
      },
      {
        "title": "Applications of Periodic Classification of Elements",
        "explanation": "This concept explains common uses, examples, or relevance of Periodic Classification of Elements."
      }
    ]
  },
  "practice_questions": [
    {
      "question_id": "10_science_periodic_classification_of_elements_pq_001",
      "type": "very_short_answer",
      "difficulty": "easy",
      "question": "What is the main idea introduced in the chapter 'Periodic Classification of Elements'?",
      "answer": "The chapter 'Periodic Classification of Elements' introduces foundational concepts in science for Class 10."
    },
    {
      "question_id": "10_science_periodic_classification_of_elements_pq_002",
      "type": "short_answer",
      "difficulty": "medium",
      "question": "Explain one important concept from the chapter 'Periodic Classification of Elements'.",
      "answer": "One important concept from 'Periodic Classification of Elements' is understanding its core ideas and how they apply within science."
    },
    {
      "question_id": "10_science_periodic_classification_of_elements_pq_003",
      "type": "application_based",
      "difficulty": "hard",
      "question": "How can the ideas from 'Periodic Classification of Elements' be applied in a practical learning context?",
      "answer": "The ideas from 'Periodic Classification of Elements' can be applied by solving examples, analyzing situations, and connecting concepts to real learning problems in science."
    }
  ],
  "mcqs": [
    {
      "mcq_id": "10_science_periodic_classification_of_elements_mcq_001",
      "difficulty": "easy",
      "question": "What is the main focus of the chapter 'Periodic Classification of Elements'?",
      "options": {
        "A": "Understanding the core concepts of Periodic Classification of Elements",
        "B": "Learning only historical facts",
        "C": "Ignoring practical applications",
        "D": "Memorizing unrelated topics"
      },
      "correct_answer": "A",
      "explanation": "The chapter 'Periodic Classification of Elements' mainly focuses on understanding its core concepts in science for Class 10."
    },
    {
      "mcq_id": "10_science_periodic_classification_of_elements_mcq_002",
      "difficulty": "medium",
      "question": "Which of the following best describes a useful way to study 'Periodic Classification of Elements'?",
      "options": {
        "A": "Avoiding all examples",
        "B": "Reviewing concepts and practicing questions",
        "C": "Skipping the summary section",
        "D": "Reading unrelated chapters only"
      },
      "correct_answer": "B",
      "explanation": "A useful way to study 'Periodic Classification of Elements' is by reviewing the concepts carefully and practicing relevant questions."
    },
    {
      "mcq_id": "10_science_periodic_classification_of_elements_mcq_003",
      "difficulty": "hard",
      "question": "Why is 'Periodic Classification of Elements' important in the study of science?",
      "options": {
        "A": "Because it replaces all other chapters",
        "B": "Because it has no connection to the subject",
        "C": "Because it builds understanding of important ideas within science",
        "D": "Because it is only useful for memorization"
      },
      "correct_answer": "C",
      "explanation": "'Periodic Classification of Elements' is important because it helps build understanding of major ideas and their relevance within science."
    }
  ],
  "metadata": {
    "status": "draft",
    "reviewed": false,
    "tags": [],
    "source": "NCERT-based",
    "last_updated": "2026-03-16"
  }
}