{
  "id": "cbse-8-mathematics-geometrical_constructions",
  "curriculum": "CBSE",
  "class": 8,
  "stream": null,
  "subject": "mathematics",
  "chapter_number": 13,
  "chapter_title": "Geometrical Constructions",
  "language": "en",
  "book": "Ganita Prakash (Grade 8)",
  "version": "1.0",
  "summary": {
    "short_summary": "This chapter introduces the main ideas of Geometrical Constructions in mathematics.",
    "detailed_summary": "This chapter for Class 8 mathematics explains the core concepts of Geometrical Constructions. It is intended as a structured study summary for CBSE learners.",
    "key_concepts": [
      {
        "title": "Introduction to Geometrical Constructions",
        "explanation": "This concept introduces the basic idea of Geometrical Constructions."
      },
      {
        "title": "Core ideas in Geometrical Constructions",
        "explanation": "This concept covers the main principles and important points in Geometrical Constructions."
      },
      {
        "title": "Applications of Geometrical Constructions",
        "explanation": "This concept explains common uses, examples, or relevance of Geometrical Constructions."
      }
    ]
  },
  "practice_questions": [
    {
      "question_id": "8_mathematics_geometrical_constructions_pq_001",
      "type": "very_short_answer",
      "difficulty": "easy",
      "question": "What is the main idea introduced in the chapter 'Geometrical Constructions'?",
      "answer": "The chapter 'Geometrical Constructions' introduces foundational concepts in mathematics for Class 8."
    },
    {
      "question_id": "8_mathematics_geometrical_constructions_pq_002",
      "type": "short_answer",
      "difficulty": "medium",
      "question": "Explain one important concept from the chapter 'Geometrical Constructions'.",
      "answer": "One important concept from 'Geometrical Constructions' is understanding its core ideas and how they apply within mathematics."
    },
    {
      "question_id": "8_mathematics_geometrical_constructions_pq_003",
      "type": "application_based",
      "difficulty": "hard",
      "question": "How can the ideas from 'Geometrical Constructions' be applied in a practical learning context?",
      "answer": "The ideas from 'Geometrical Constructions' can be applied by solving examples, analyzing situations, and connecting concepts to real learning problems in mathematics."
    }
  ],
  "mcqs": [
    {
      "mcq_id": "8_mathematics_geometrical_constructions_mcq_001",
      "difficulty": "easy",
      "question": "What is the main focus of the chapter 'Geometrical Constructions'?",
      "options": {
        "A": "Understanding the core concepts of Geometrical Constructions",
        "B": "Learning only historical facts",
        "C": "Ignoring practical applications",
        "D": "Memorizing unrelated topics"
      },
      "correct_answer": "A",
      "explanation": "The chapter 'Geometrical Constructions' mainly focuses on understanding its core concepts in mathematics for Class 8."
    },
    {
      "mcq_id": "8_mathematics_geometrical_constructions_mcq_002",
      "difficulty": "medium",
      "question": "Which of the following best describes a useful way to study 'Geometrical Constructions'?",
      "options": {
        "A": "Avoiding all examples",
        "B": "Reviewing concepts and practicing questions",
        "C": "Skipping the summary section",
        "D": "Reading unrelated chapters only"
      },
      "correct_answer": "B",
      "explanation": "A useful way to study 'Geometrical Constructions' is by reviewing the concepts carefully and practicing relevant questions."
    },
    {
      "mcq_id": "8_mathematics_geometrical_constructions_mcq_003",
      "difficulty": "hard",
      "question": "Why is 'Geometrical Constructions' important in the study of mathematics?",
      "options": {
        "A": "Because it replaces all other chapters",
        "B": "Because it has no connection to the subject",
        "C": "Because it builds understanding of important ideas within mathematics",
        "D": "Because it is only useful for memorization"
      },
      "correct_answer": "C",
      "explanation": "'Geometrical Constructions' is important because it helps build understanding of major ideas and their relevance within mathematics."
    }
  ],
  "metadata": {
    "status": "draft",
    "reviewed": false,
    "tags": [],
    "source": "NCERT-based",
    "last_updated": "2026-03-16"
  }
}