{
  "id": "cbse-12-science-mathematics-relations_and_functions",
  "curriculum": "CBSE",
  "class": 12,
  "stream": "science",
  "subject": "mathematics",
  "chapter_number": 1,
  "chapter_title": "Relations and Functions",
  "language": "en",
  "book": "NCERT Mathematics",
  "version": "1.0",
  "summary": {
    "short_summary": "This chapter introduces the main ideas of Relations and Functions in mathematics.",
    "detailed_summary": "This chapter for Class 12 mathematics explains the core concepts of Relations and Functions. It is intended as a structured study summary for CBSE learners.",
    "key_concepts": [
      {
        "title": "Introduction to Relations and Functions",
        "explanation": "This concept introduces the basic idea of Relations and Functions."
      },
      {
        "title": "Core ideas in Relations and Functions",
        "explanation": "This concept covers the main principles and important points in Relations and Functions."
      },
      {
        "title": "Applications of Relations and Functions",
        "explanation": "This concept explains common uses, examples, or relevance of Relations and Functions."
      }
    ]
  },
  "practice_questions": [
    {
      "question_id": "12_science_mathematics_relations_and_functions_pq_001",
      "type": "very_short_answer",
      "difficulty": "easy",
      "question": "What is the main idea introduced in the chapter 'Relations and Functions'?",
      "answer": "The chapter 'Relations and Functions' introduces foundational concepts in mathematics for Class 12."
    },
    {
      "question_id": "12_science_mathematics_relations_and_functions_pq_002",
      "type": "short_answer",
      "difficulty": "medium",
      "question": "Explain one important concept from the chapter 'Relations and Functions'.",
      "answer": "One important concept from 'Relations and Functions' is understanding its core ideas and how they apply within mathematics."
    },
    {
      "question_id": "12_science_mathematics_relations_and_functions_pq_003",
      "type": "application_based",
      "difficulty": "hard",
      "question": "How can the ideas from 'Relations and Functions' be applied in a practical learning context?",
      "answer": "The ideas from 'Relations and Functions' can be applied by solving examples, analyzing situations, and connecting concepts to real learning problems in mathematics."
    }
  ],
  "mcqs": [
    {
      "mcq_id": "12_science_mathematics_relations_and_functions_mcq_001",
      "difficulty": "easy",
      "question": "What is the main focus of the chapter 'Relations and Functions'?",
      "options": {
        "A": "Understanding the core concepts of Relations and Functions",
        "B": "Learning only historical facts",
        "C": "Ignoring practical applications",
        "D": "Memorizing unrelated topics"
      },
      "correct_answer": "A",
      "explanation": "The chapter 'Relations and Functions' mainly focuses on understanding its core concepts in mathematics for Class 12."
    },
    {
      "mcq_id": "12_science_mathematics_relations_and_functions_mcq_002",
      "difficulty": "medium",
      "question": "Which of the following best describes a useful way to study 'Relations and Functions'?",
      "options": {
        "A": "Avoiding all examples",
        "B": "Reviewing concepts and practicing questions",
        "C": "Skipping the summary section",
        "D": "Reading unrelated chapters only"
      },
      "correct_answer": "B",
      "explanation": "A useful way to study 'Relations and Functions' is by reviewing the concepts carefully and practicing relevant questions."
    },
    {
      "mcq_id": "12_science_mathematics_relations_and_functions_mcq_003",
      "difficulty": "hard",
      "question": "Why is 'Relations and Functions' important in the study of mathematics?",
      "options": {
        "A": "Because it replaces all other chapters",
        "B": "Because it has no connection to the subject",
        "C": "Because it builds understanding of important ideas within mathematics",
        "D": "Because it is only useful for memorization"
      },
      "correct_answer": "C",
      "explanation": "'Relations and Functions' is important because it helps build understanding of major ideas and their relevance within mathematics."
    }
  ],
  "metadata": {
    "status": "draft",
    "reviewed": false,
    "tags": [],
    "source": "NCERT-based",
    "last_updated": "2026-03-16"
  }
}