{
  "id": "cbse-6-science-materials_around_us",
  "curriculum": "CBSE",
  "class": 6,
  "stream": null,
  "subject": "science",
  "chapter_number": 6,
  "chapter_title": "Materials Around Us",
  "language": "en",
  "book": "Curiosity (Grade 6)",
  "version": "1.0",
  "summary": {
    "short_summary": "This chapter introduces the main ideas of Materials Around Us in science.",
    "detailed_summary": "This chapter for Class 6 science explains the core concepts of Materials Around Us. It is intended as a structured study summary for CBSE learners.",
    "key_concepts": [
      {
        "title": "Introduction to Materials Around Us",
        "explanation": "This concept introduces the basic idea of Materials Around Us."
      },
      {
        "title": "Core ideas in Materials Around Us",
        "explanation": "This concept covers the main principles and important points in Materials Around Us."
      },
      {
        "title": "Applications of Materials Around Us",
        "explanation": "This concept explains common uses, examples, or relevance of Materials Around Us."
      }
    ]
  },
  "practice_questions": [
    {
      "question_id": "6_science_materials_around_us_pq_001",
      "type": "very_short_answer",
      "difficulty": "easy",
      "question": "What is the main idea introduced in the chapter 'Materials Around Us'?",
      "answer": "The chapter 'Materials Around Us' introduces foundational concepts in science for Class 6."
    },
    {
      "question_id": "6_science_materials_around_us_pq_002",
      "type": "short_answer",
      "difficulty": "medium",
      "question": "Explain one important concept from the chapter 'Materials Around Us'.",
      "answer": "One important concept from 'Materials Around Us' is understanding its core ideas and how they apply within science."
    },
    {
      "question_id": "6_science_materials_around_us_pq_003",
      "type": "application_based",
      "difficulty": "hard",
      "question": "How can the ideas from 'Materials Around Us' be applied in a practical learning context?",
      "answer": "The ideas from 'Materials Around Us' can be applied by solving examples, analyzing situations, and connecting concepts to real learning problems in science."
    }
  ],
  "mcqs": [
    {
      "mcq_id": "6_science_materials_around_us_mcq_001",
      "difficulty": "easy",
      "question": "What is the main focus of the chapter 'Materials Around Us'?",
      "options": {
        "A": "Understanding the core concepts of Materials Around Us",
        "B": "Learning only historical facts",
        "C": "Ignoring practical applications",
        "D": "Memorizing unrelated topics"
      },
      "correct_answer": "A",
      "explanation": "The chapter 'Materials Around Us' mainly focuses on understanding its core concepts in science for Class 6."
    },
    {
      "mcq_id": "6_science_materials_around_us_mcq_002",
      "difficulty": "medium",
      "question": "Which of the following best describes a useful way to study 'Materials Around Us'?",
      "options": {
        "A": "Avoiding all examples",
        "B": "Reviewing concepts and practicing questions",
        "C": "Skipping the summary section",
        "D": "Reading unrelated chapters only"
      },
      "correct_answer": "B",
      "explanation": "A useful way to study 'Materials Around Us' is by reviewing the concepts carefully and practicing relevant questions."
    },
    {
      "mcq_id": "6_science_materials_around_us_mcq_003",
      "difficulty": "hard",
      "question": "Why is 'Materials Around Us' important in the study of science?",
      "options": {
        "A": "Because it replaces all other chapters",
        "B": "Because it has no connection to the subject",
        "C": "Because it builds understanding of important ideas within science",
        "D": "Because it is only useful for memorization"
      },
      "correct_answer": "C",
      "explanation": "'Materials Around Us' is important because it helps build understanding of major ideas and their relevance within science."
    }
  ],
  "metadata": {
    "status": "draft",
    "reviewed": false,
    "tags": [],
    "source": "NCERT-based",
    "last_updated": "2026-03-16"
  }
}