{
  "id": "cbse-11-science-mathematics-conic_sections",
  "curriculum": "CBSE",
  "class": 11,
  "stream": "science",
  "subject": "mathematics",
  "chapter_number": 10,
  "chapter_title": "Conic Sections",
  "language": "en",
  "book": "NCERT Mathematics",
  "version": "1.0",
  "summary": {
    "short_summary": "This chapter introduces the main ideas of Conic Sections in mathematics.",
    "detailed_summary": "This chapter for Class 11 mathematics explains the core concepts of Conic Sections. It is intended as a structured study summary for CBSE learners.",
    "key_concepts": [
      {
        "title": "Introduction to Conic Sections",
        "explanation": "This concept introduces the basic idea of Conic Sections."
      },
      {
        "title": "Core ideas in Conic Sections",
        "explanation": "This concept covers the main principles and important points in Conic Sections."
      },
      {
        "title": "Applications of Conic Sections",
        "explanation": "This concept explains common uses, examples, or relevance of Conic Sections."
      }
    ]
  },
  "practice_questions": [
    {
      "question_id": "11_science_mathematics_conic_sections_pq_001",
      "type": "very_short_answer",
      "difficulty": "easy",
      "question": "What is the main idea introduced in the chapter 'Conic Sections'?",
      "answer": "The chapter 'Conic Sections' introduces foundational concepts in mathematics for Class 11."
    },
    {
      "question_id": "11_science_mathematics_conic_sections_pq_002",
      "type": "short_answer",
      "difficulty": "medium",
      "question": "Explain one important concept from the chapter 'Conic Sections'.",
      "answer": "One important concept from 'Conic Sections' is understanding its core ideas and how they apply within mathematics."
    },
    {
      "question_id": "11_science_mathematics_conic_sections_pq_003",
      "type": "application_based",
      "difficulty": "hard",
      "question": "How can the ideas from 'Conic Sections' be applied in a practical learning context?",
      "answer": "The ideas from 'Conic Sections' can be applied by solving examples, analyzing situations, and connecting concepts to real learning problems in mathematics."
    }
  ],
  "mcqs": [
    {
      "mcq_id": "11_science_mathematics_conic_sections_mcq_001",
      "difficulty": "easy",
      "question": "What is the main focus of the chapter 'Conic Sections'?",
      "options": {
        "A": "Understanding the core concepts of Conic Sections",
        "B": "Learning only historical facts",
        "C": "Ignoring practical applications",
        "D": "Memorizing unrelated topics"
      },
      "correct_answer": "A",
      "explanation": "The chapter 'Conic Sections' mainly focuses on understanding its core concepts in mathematics for Class 11."
    },
    {
      "mcq_id": "11_science_mathematics_conic_sections_mcq_002",
      "difficulty": "medium",
      "question": "Which of the following best describes a useful way to study 'Conic Sections'?",
      "options": {
        "A": "Avoiding all examples",
        "B": "Reviewing concepts and practicing questions",
        "C": "Skipping the summary section",
        "D": "Reading unrelated chapters only"
      },
      "correct_answer": "B",
      "explanation": "A useful way to study 'Conic Sections' is by reviewing the concepts carefully and practicing relevant questions."
    },
    {
      "mcq_id": "11_science_mathematics_conic_sections_mcq_003",
      "difficulty": "hard",
      "question": "Why is 'Conic Sections' important in the study of mathematics?",
      "options": {
        "A": "Because it replaces all other chapters",
        "B": "Because it has no connection to the subject",
        "C": "Because it builds understanding of important ideas within mathematics",
        "D": "Because it is only useful for memorization"
      },
      "correct_answer": "C",
      "explanation": "'Conic Sections' is important because it helps build understanding of major ideas and their relevance within mathematics."
    }
  ],
  "metadata": {
    "status": "draft",
    "reviewed": false,
    "tags": [],
    "source": "NCERT-based",
    "last_updated": "2026-03-16"
  }
}